{
  "format": "wrench.loader.contract_bundle.v0.1",
  "extraction_requests": [
    {
      "format": "wrench.extraction_request.v0.1",
      "request_id": "req_html_01",
      "actor_ref": "actor_local_owner",
      "workspace_ref": "workspace_demo",
      "input": {
        "kind": "file_ref",
        "ref": "file_html_01",
        "media_type": "text/html",
        "content_hash": "sha256:1000000000000000000000000000000000000000000000000000000000000000"
      },
      "policy": {
        "allowed_media_types": ["text/html"],
        "max_bytes": 1000000,
        "network": "disabled",
        "ocr": "disabled",
        "stt": "disabled",
        "pii_mode": "detect",
        "secret_mode": "block",
        "prompt_injection_mode": "detect"
      },
      "requested_outputs": ["canonical_document", "evidence_report", "gear_source_candidate"]
    }
  ],
  "canonical_documents": [
    {
      "format": "wrench.canonical_source_document.v0.1",
      "document_id": "csd_html_01",
      "source": {
        "input_type": "html",
        "uri": null,
        "filename": "demo.html",
        "media_type": "text/html",
        "size_bytes": 512,
        "content_hash": "sha256:1000000000000000000000000000000000000000000000000000000000000000",
        "retrieved_at": "2026-06-30T00:00:00Z"
      },
      "canonical": {
        "title": "Demo source",
        "language": "en",
        "text": "Demo source\nA short deterministic source.",
        "markdown": "# Demo source\n\nA short deterministic source.",
        "structure": [
          {
            "block_id": "blk_title",
            "type": "heading",
            "text": "Demo source",
            "markdown": "# Demo source",
            "source_span": {
              "page": null,
              "byte_start": 0,
              "byte_end": 64,
              "selector": "h1"
            }
          },
          {
            "block_id": "blk_para",
            "type": "paragraph",
            "text": "A short deterministic source.",
            "markdown": "A short deterministic source.",
            "source_span": {
              "page": null,
              "byte_start": 65,
              "byte_end": 128,
              "selector": "p:nth-of-type(1)"
            }
          }
        ],
        "chunks": [
          {
            "chunk_id": "chk_01",
            "block_ids": ["blk_title", "blk_para"],
            "text": "Demo source\nA short deterministic source.",
            "token_estimate": 8,
            "citation_label": "h1 + p1"
          }
        ]
      },
      "metadata": {
        "license": "unknown",
        "authors_count": 0
      },
      "security": {
        "classification": "public",
        "prompt_injection": {
          "detected": false,
          "findings": []
        },
        "pii": {
          "detected": false,
          "categories": [],
          "findings": []
        },
        "secrets": {
          "detected": false,
          "findings": []
        },
        "active_content_removed": true
      },
      "quality": {
        "extraction_status": "ok",
        "confidence": 0.98,
        "warnings": [],
        "unsupported_features": []
      },
      "provenance": {
        "tool": "wrench-loader",
        "tool_version": "0.1.0",
        "pipeline_id": "pipeline_html_default_v1",
        "started_at": "2026-06-30T00:00:00Z",
        "completed_at": "2026-06-30T00:00:01Z",
        "input_refs": ["file_html_01"],
        "output_hash": "sha256:2000000000000000000000000000000000000000000000000000000000000000"
      }
    }
  ],
  "gear_source_candidates": [
    {
      "format": "wrench.gear_source_candidate.v0.1",
      "canonical_document_ref": "csd_html_01",
      "source_type": "document",
      "origin_product": "wrench-loader",
      "content_hash": "sha256:2000000000000000000000000000000000000000000000000000000000000000",
      "provenance": {
        "tool_ref": "wrench-loader@0.1.0",
        "pipeline_id": "pipeline_html_default_v1"
      },
      "indexing_hints": {
        "language": "en",
        "chunk_ids": ["chk_01"],
        "sensitive": false
      }
    }
  ],
  "loader_evidence_reports": [
    {
      "format": "wrench.loader_evidence_report.v0.1",
      "report_id": "ler_html_01",
      "request_id": "req_html_01",
      "canonical_document_id": "csd_html_01",
      "status": "passed",
      "input_evidence": {
        "media_type": "text/html",
        "size_bytes": 512,
        "content_hash": "sha256:1000000000000000000000000000000000000000000000000000000000000000"
      },
      "pipeline_evidence": {
        "tool_version": "0.1.0",
        "pipeline_id": "pipeline_html_default_v1",
        "deterministic": true,
        "sandboxed": true,
        "network_policy": "disabled"
      },
      "extraction_evidence": {
        "blocks_emitted": 2,
        "chunks_emitted": 1,
        "coverage_ratio": 1.0,
        "confidence": 0.98
      },
      "security_evidence": {
        "active_content_removed": true,
        "prompt_injection_count": 0,
        "pii_count": 0,
        "secret_count": 0
      },
      "policy_evidence": {
        "blocked_by_policy": false,
        "policy_decisions": []
      },
      "outputs": {
        "canonical_hash": "sha256:2000000000000000000000000000000000000000000000000000000000000000",
        "gear_source_candidate_hash": "sha256:3000000000000000000000000000000000000000000000000000000000000000"
      }
    }
  ]
}
